{
  "schema_version": 2,
  "sources": {
    "webref_css": {
      "name": "@webref/css",
      "version": "8.7.6",
      "url": "https://unpkg.com/@webref/css@8.7.6/css.json"
    },
    "css_unit_pages": [
      "https://drafts.csswg.org/css-values-4/"
    ],
    "svg_clock_value_syntax": "https://svgwg.org/specs/animations/",
    "paths_html": "https://raw.githubusercontent.com/w3c/svgwg/47e645ef7cb61490e6975ddbcfa1997c9e972cc3/master/paths.html"
  },
  "attribute_buckets": {
    "keyword": [
      "accumulate",
      "additive",
      "alignment-baseline",
      "aria-autocomplete",
      "aria-checked",
      "aria-current",
      "aria-dropeffect",
      "aria-expanded",
      "aria-grabbed",
      "aria-haspopup",
      "aria-hidden",
      "aria-invalid",
      "aria-live",
      "aria-orientation",
      "aria-pressed",
      "aria-relevant",
      "aria-selected",
      "aria-sort",
      "attributeType",
      "border-style",
      "border-top-style",
      "calcMode",
      "clip-rule",
      "clipPathUnits",
      "color-interpolation",
      "color-interpolation-filters",
      "crossorigin",
      "decoding",
      "direction",
      "display",
      "dominant-baseline",
      "edgeMode",
      "externalResourcesRequired",
      "fetchpriority",
      "fill-rule",
      "filterUnits",
      "font-kerning",
      "font-stretch",
      "font-style",
      "font-variant",
      "font-variant-ligatures",
      "font-weight",
      "glyph-orientation-vertical",
      "gradientUnits",
      "hanging-punctuation",
      "hyphens",
      "image-rendering",
      "isolation",
      "lengthAdjust",
      "line-break",
      "markerUnits",
      "mask-type",
      "maskContentUnits",
      "maskUnits",
      "method",
      "mode",
      "object-fit",
      "operator",
      "origin",
      "overflow",
      "overflow-wrap",
      "paint-order",
      "patternContentUnits",
      "patternUnits",
      "playbackorder",
      "pointer-events",
      "preserveAlpha",
      "primitiveUnits",
      "restart",
      "shape-rendering",
      "side",
      "spacing",
      "spreadMethod",
      "stitchTiles",
      "stroke-linecap",
      "stroke-linejoin",
      "text-align-last",
      "text-anchor",
      "text-decoration-line",
      "text-decoration-style",
      "text-justify",
      "text-orientation",
      "text-rendering",
      "text-transform",
      "timelinebegin",
      "transform-box",
      "unicode-bidi",
      "vector-effect",
      "visibility",
      "white-space",
      "word-break",
      "word-wrap",
      "writing-mode",
      "xChannelSelector",
      "xlink:actuate",
      "xlink:show",
      "xml:space",
      "yChannelSelector",
      "zoomAndPan"
    ],
    "color": [
      "color",
      "fill",
      "flood-color",
      "lighting-color",
      "stop-color",
      "stroke",
      "text-decoration-color"
    ],
    "length": [
      "baseline-shift",
      "cx",
      "cy",
      "font-size-adjust",
      "fr",
      "fx",
      "fy",
      "height",
      "inline-size",
      "kerning",
      "letter-spacing",
      "line-height",
      "markerHeight",
      "markerWidth",
      "object-position",
      "path-length",
      "r",
      "refX",
      "refY",
      "rx",
      "ry",
      "startOffset",
      "stroke-dashoffset",
      "stroke-width",
      "tab-size",
      "text-combine-upright",
      "text-indent",
      "textLength",
      "transform-origin",
      "width",
      "word-spacing",
      "x1",
      "x2",
      "y1",
      "y2"
    ],
    "length_list": [
      "dx",
      "dy",
      "font-feature-settings",
      "x",
      "y"
    ],
    "length_list_or_none": [
      "stroke-dasharray"
    ],
    "number": [
      "amplitude",
      "aria-colcount",
      "aria-colindex",
      "aria-colspan",
      "aria-level",
      "aria-posinset",
      "aria-rowcount",
      "aria-rowindex",
      "aria-rowspan",
      "aria-setsize",
      "aria-valuemax",
      "aria-valuemin",
      "aria-valuenow",
      "azimuth",
      "bias",
      "diffuseConstant",
      "divisor",
      "elevation",
      "exponent",
      "intercept",
      "k1",
      "k2",
      "k3",
      "k4",
      "limitingConeAngle",
      "numOctaves",
      "pathLength",
      "pointsAtX",
      "pointsAtY",
      "pointsAtZ",
      "scale",
      "seed",
      "slope",
      "specularConstant",
      "specularExponent",
      "stroke-miterlimit",
      "surfaceScale",
      "tabindex",
      "targetX",
      "targetY",
      "version",
      "z"
    ],
    "number_optional_number": [
      "baseFrequency",
      "kernelUnitLength",
      "order",
      "radius",
      "stdDeviation"
    ],
    "number_list": [
      "kernelMatrix",
      "keyPoints",
      "tableValues"
    ],
    "number_or_percentage": [
      "fill-opacity",
      "flood-opacity",
      "font-width",
      "opacity",
      "stop-opacity",
      "stroke-opacity"
    ],
    "coordinate_pair_list": [
      "points"
    ],
    "path_data": [
      "d",
      "path"
    ],
    "view_box": [
      "viewBox"
    ],
    "functional_iri": [
      "background",
      "clip-path",
      "content",
      "cursor",
      "filter",
      "marker",
      "marker-end",
      "marker-mid",
      "marker-start",
      "mask",
      "shape-outside"
    ],
    "css_text": [
      "aria-activedescendant",
      "aria-atomic",
      "aria-busy",
      "aria-controls",
      "aria-describedby",
      "aria-details",
      "aria-disabled",
      "aria-errormessage",
      "aria-flowto",
      "aria-labelledby",
      "aria-modal",
      "aria-multiline",
      "aria-multiselectable",
      "aria-owns",
      "aria-readonly",
      "aria-required",
      "async",
      "attributeName",
      "autofocus",
      "begin",
      "block-size",
      "color-profile",
      "defer",
      "download",
      "end",
      "float",
      "font",
      "font-family",
      "font-size",
      "glyph-orientation-horizontal",
      "hreflang",
      "in",
      "in2",
      "interestfor",
      "lang",
      "margin-top",
      "max",
      "max-width",
      "media",
      "min",
      "min-width",
      "orient",
      "outline",
      "ping",
      "position",
      "referrerpolicy",
      "rel",
      "requiredExtensions",
      "result",
      "role",
      "systemLanguage",
      "target",
      "text-align",
      "text-decoration",
      "text-overflow",
      "vertical-align",
      "will-change",
      "xml:lang"
    ]
  },
  "tokens": {
    "length_units": [
      "em",
      "rem",
      "ex",
      "rex",
      "cap",
      "rcap",
      "ch",
      "rch",
      "ic",
      "ric",
      "lh",
      "rlh",
      "vw",
      "svw",
      "lvw",
      "dvw",
      "vh",
      "svh",
      "lvh",
      "dvh",
      "vi",
      "svi",
      "lvi",
      "dvi",
      "vb",
      "svb",
      "lvb",
      "dvb",
      "vmin",
      "svmin",
      "lvmin",
      "dvmin",
      "vmax",
      "svmax",
      "lvmax",
      "dvmax",
      "cm",
      "mm",
      "Q",
      "in",
      "pc",
      "pt",
      "px"
    ],
    "angle_units": [
      "deg",
      "grad",
      "rad",
      "turn"
    ],
    "time_units": [
      "h",
      "min",
      "s",
      "ms"
    ],
    "color_spaces": [
      "a98-rgb",
      "display-p3",
      "display-p3-linear",
      "prophoto-rgb",
      "rec2020",
      "rec2100-hlg",
      "rec2100-linear",
      "rec2100-pq",
      "srgb",
      "srgb-linear",
      "xyz",
      "xyz-d50",
      "xyz-d65"
    ],
    "color_interpolation_spaces": [
      "a98-rgb",
      "display-p3",
      "display-p3-linear",
      "hsl",
      "hwb",
      "lab",
      "lch",
      "oklab",
      "oklch",
      "prophoto-rgb",
      "rec2020",
      "srgb",
      "srgb-linear",
      "xyz",
      "xyz-d50",
      "xyz-d65"
    ],
    "hue_interpolation_methods": [
      "decreasing",
      "increasing",
      "longer",
      "shorter"
    ],
    "path_command_letters": [
      "A",
      "C",
      "H",
      "L",
      "M",
      "Q",
      "S",
      "T",
      "V",
      "Z",
      "a",
      "c",
      "h",
      "l",
      "m",
      "q",
      "s",
      "t",
      "v",
      "z"
    ]
  }
}
